{"checks":[{"description":"row count","expected":5000000,"id":"rows","observed":5000000,"passed":true},{"description":"no null or non-finite cells in the 17 channels","expected":0,"id":"no_nulls","observed":0,"passed":true},{"description":"timestamps strictly 1 s apart, starting 2023-01-01T00:00:00","expected":"2023-01-01T00:00:00","id":"timestamps_1s","observed":"2023-01-01T00:00:00","passed":true},{"description":"y is 0/1","expected":[0,1],"id":"labels_binary","observed":[0,1],"passed":true},{"description":"200 contiguous labelled segments","expected":200,"id":"segments_200","observed":200,"passed":true},{"description":"segment starts and exclusive ends equal metadata.csv","expected":0,"id":"segments_match_metadata","observed":0,"passed":true},{"description":"y rebuilt from metadata (end exclusive) has zero mismatches","expected":0,"id":"labels_rebuild","observed":0,"passed":true},{"description":"an inclusive-end reading would mismatch (documents the convention)","expected":200,"id":"end_inclusive_wrong","observed":200,"passed":true},{"description":"segments sorted and non-overlapping","expected":0,"id":"no_overlap","observed":0,"passed":true},{"description":"no anomaly in the first 1,000,000 rows","expected":0,"id":"clean_first_million","observed":0,"passed":true},{"description":"contamination about 0.038","expected":0.038,"id":"contamination","observed":0.03802,"passed":true},{"description":"category > 0 exactly where y = 1, and equals metadata","expected":0,"id":"category_consistent","observed":0,"passed":true},{"description":"categories in 1..13","expected":[1,2,3,4,5,6,7,8,9,10,11,12,13],"id":"category_range","observed":[1,2,3,4,5,6,7,8,9,10,11,12,13],"passed":true},{"description":"root_cause always a b* telemetry channel","expected":"subset of TELEMETRY","id":"root_cause_domain","observed":["bed1","bed2","bfo1","bfo2","bso1","bso2","bso3"],"passed":true},{"description":"affected channels are telemetry channels","expected":"subset of TELEMETRY","id":"affected_domain","observed":["ced1","cfo1","cso1"],"passed":true},{"description":"aimp, adbr, adfl take only values 0 and 1","expected":[],"id":"binary_context","observed":[],"passed":true},{"description":"every channel has non-zero variance in train","expected":0,"id":"train_variance","observed":0,"passed":true},{"description":"no split boundary falls inside a labelled segment","expected":[],"id":"splits_cut_no_segment","observed":[],"passed":true},{"description":"gbm_fit, val and test each hold at least 40 segments; train none","expected":"train 0, others >= 40","id":"split_segments","observed":{"gbm_fit":83,"test":67,"train":0,"val":50},"passed":true},{"description":"splits are contiguous, ordered and cover all rows","expected":"ok","id":"split_order","observed":"ok","passed":true},{"description":"raw files match the sha256 manifest","expected":"all match","id":"raw_checksums","observed":["CATS-DDD.pdf","data.parquet","metadata.csv"],"passed":true},{"description":"17 channels = 7 context + 10 telemetry","expected":17,"id":"context_group","observed":17,"passed":true}],"failed":0,"passed":22,"schema_version":"v1","tags":{"quality":"DERIVED"}}
